{
  "$schema": "../../schemas/effect.schema.json",
  "schema_version": 1,
  "key": "cab.brit_ld_4x12",
  "class_key": "cab",
  "menu_number": 14,
  "name": "BRIT LD 4X12",
  "model_id": 31,
  "secondary_selector": 10,
  "capabilities": [],
  "parameter_catalog_status": "pending",
  "parameters": []
}
