{
  "$schema": "../../schemas/effect.schema.json",
  "schema_version": 1,
  "key": "freq.pitch_s",
  "class_key": "freq",
  "menu_number": 6,
  "name": "Pitch S",
  "model_id": 85,
  "secondary_selector": 1,
  "capabilities": [
    "parameters"
  ],
  "parameter_catalog_status": "physically_validated",
  "parameters": [
    {
      "key": "range",
      "name": "RANGE",
      "display_order": 1,
      "value_type": "enum",
      "range": {
        "minimum": 0,
        "maximum": 5,
        "step": 1
      },
      "choices": [
        {
          "value": 0,
          "label": "-2 OCT"
        },
        {
          "value": 1,
          "label": "-1 OCT"
        },
        {
          "value": 2,
          "label": "+1 OCT"
        },
        {
          "value": 3,
          "label": "+2 OCT"
        },
        {
          "value": 4,
          "label": "+/-1 OCT"
        },
        {
          "value": 5,
          "label": "+/-2 OCT"
        }
      ],
      "unit": null,
      "protocol": {
        "profile": "effect_parameter_response_1c_v1",
        "value_codec": "upper_float32_nibbles_v1",
        "identification_status": "validated_with_chain_effect_context",
        "message_match": {
          "parameter_selector": 0,
          "parameter_marker": 1,
          "parameter_type": 1
        }
      },
      "validation": {
        "offline": true,
        "physical": true,
        "read_only": true,
        "enum_wire_values_validated": [
          0,
          1,
          2,
          3,
          4,
          5
        ],
        "internal_slots_observed": [
          1
        ],
        "effect_identity_source": "current_chain",
        "parameter_selector": 0,
        "multiple_parameters": true,
        "saved_dump_default": 2,
        "physical_saved_dump_count": 3,
        "physical_live_sweep": true,
        "evidence": "docs/phases/FREQ_PITCH_S_RANGE_PARAMETERS_PHASE39.md",
        "monitor_integration_physical_validation": "pending"
      }
    },
    {
      "key": "position",
      "name": "POSITION",
      "display_order": 2,
      "value_type": "integer",
      "range": {
        "minimum": 0,
        "maximum": 100,
        "step": 1
      },
      "unit": null,
      "protocol": {
        "profile": "effect_parameter_response_1c_v1",
        "value_codec": "upper_float32_nibbles_v1",
        "identification_status": "validated_with_chain_effect_context",
        "message_match": {
          "parameter_selector": 1,
          "parameter_marker": 1,
          "parameter_type": 1
        }
      },
      "validation": {
        "offline": true,
        "physical": true,
        "read_only": true,
        "range_validated": [
          0,
          100
        ],
        "internal_slots_observed": [
          1
        ],
        "effect_identity_source": "current_chain",
        "parameter_selector": 1,
        "multiple_parameters": true,
        "saved_dump_default": 0,
        "physical_saved_dump_count": 3,
        "physical_live_sweep": true,
        "evidence": "docs/phases/FREQ_PITCH_S_RANGE_PARAMETERS_PHASE39.md",
        "monitor_integration_physical_validation": "pending"
      }
    },
    {
      "key": "mix",
      "name": "MIX",
      "display_order": 3,
      "value_type": "integer",
      "range": {
        "minimum": 0,
        "maximum": 100,
        "step": 1
      },
      "unit": null,
      "protocol": {
        "profile": "effect_parameter_response_1c_v1",
        "value_codec": "upper_float32_nibbles_v1",
        "identification_status": "validated_with_chain_effect_context",
        "message_match": {
          "parameter_selector": 2,
          "parameter_marker": 1,
          "parameter_type": 1
        }
      },
      "validation": {
        "offline": true,
        "physical": true,
        "read_only": true,
        "range_validated": [
          0,
          100
        ],
        "internal_slots_observed": [
          1
        ],
        "effect_identity_source": "current_chain",
        "parameter_selector": 2,
        "multiple_parameters": true,
        "saved_dump_default": 100,
        "physical_saved_dump_count": 3,
        "physical_live_sweep": true,
        "evidence": "docs/phases/FREQ_PITCH_S_RANGE_PARAMETERS_PHASE39.md",
        "monitor_integration_physical_validation": "pending"
      }
    },
    {
      "key": "level",
      "name": "LEVEL",
      "display_order": 4,
      "value_type": "integer",
      "range": {
        "minimum": 0,
        "maximum": 100,
        "step": 1
      },
      "unit": null,
      "protocol": {
        "profile": "effect_parameter_response_1c_v1",
        "value_codec": "upper_float32_nibbles_v1",
        "identification_status": "validated_with_chain_effect_context",
        "message_match": {
          "parameter_selector": 3,
          "parameter_marker": 1,
          "parameter_type": 1
        }
      },
      "validation": {
        "offline": true,
        "physical": true,
        "read_only": true,
        "range_validated": [
          0,
          100
        ],
        "internal_slots_observed": [
          1
        ],
        "effect_identity_source": "current_chain",
        "parameter_selector": 3,
        "multiple_parameters": true,
        "saved_dump_default": 100,
        "physical_saved_dump_count": 3,
        "physical_live_sweep": true,
        "evidence": "docs/phases/FREQ_PITCH_S_RANGE_PARAMETERS_PHASE39.md",
        "monitor_integration_physical_validation": "pending"
      }
    }
  ]
}
