{
  "$schema": "../../schemas/effect.schema.json",
  "schema_version": 1,
  "key": "amp.supero_2_od",
  "class_key": "amp",
  "menu_number": 7,
  "name": "SUPERO 2 OD",
  "model_id": 40,
  "secondary_selector": 7,
  "capabilities": [
    "parameters"
  ],
  "parameter_catalog_status": "physically_validated",
  "parameters": [
    {
      "key": "gain_1",
      "name": "GAIN 1",
      "display_order": 1,
      "value_type": "integer",
      "range": {
        "minimum": 0,
        "maximum": 100,
        "step": 1
      },
      "unit": null,
      "protocol": {
        "profile": "effect_parameter_response_1c_v1",
        "value_codec": "upper_float32_nibbles_v1",
        "identification_status": "validated_with_chain_effect_context",
        "message_match": {
          "parameter_selector": 0,
          "parameter_marker": 1,
          "parameter_type": 1
        }
      },
      "validation": {
        "offline": true,
        "physical": true,
        "read_only": true,
        "effect_identity_source": "current_chain",
        "parameter_selector": 0,
        "saved_dump_default": 50,
        "saved_dump_default_source": "user_reported_official_ui",
        "selector_mapping_source": "physically_validated_from_official_ui_order",
        "evidence": "docs/phases/AMP_SUPERO_VOKS_CANDIDATES_PHASE61.md",
        "monitor_integration_physical_validation": "approved",
        "saved_dump_value": 21,
        "physical_validation_without_pcapng": true,
        "range_validated": [
          0,
          100
        ]
      }
    },
    {
      "key": "tone_1",
      "name": "TONE 1",
      "display_order": 2,
      "value_type": "integer",
      "range": {
        "minimum": 0,
        "maximum": 100,
        "step": 1
      },
      "unit": null,
      "protocol": {
        "profile": "effect_parameter_response_1c_v1",
        "value_codec": "upper_float32_nibbles_v1",
        "identification_status": "validated_with_chain_effect_context",
        "message_match": {
          "parameter_selector": 1,
          "parameter_marker": 1,
          "parameter_type": 1
        }
      },
      "validation": {
        "offline": true,
        "physical": true,
        "read_only": true,
        "effect_identity_source": "current_chain",
        "parameter_selector": 1,
        "saved_dump_default": 50,
        "saved_dump_default_source": "user_reported_official_ui",
        "selector_mapping_source": "physically_validated_from_official_ui_order",
        "evidence": "docs/phases/AMP_SUPERO_VOKS_CANDIDATES_PHASE61.md",
        "monitor_integration_physical_validation": "approved",
        "saved_dump_value": 34,
        "physical_validation_without_pcapng": true,
        "range_validated": [
          0,
          100
        ]
      }
    },
    {
      "key": "gain_2",
      "name": "GAIN 2",
      "display_order": 3,
      "value_type": "integer",
      "range": {
        "minimum": 0,
        "maximum": 100,
        "step": 1
      },
      "unit": null,
      "protocol": {
        "profile": "effect_parameter_response_1c_v1",
        "value_codec": "upper_float32_nibbles_v1",
        "identification_status": "validated_with_chain_effect_context",
        "message_match": {
          "parameter_selector": 2,
          "parameter_marker": 1,
          "parameter_type": 1
        }
      },
      "validation": {
        "offline": true,
        "physical": true,
        "read_only": true,
        "effect_identity_source": "current_chain",
        "parameter_selector": 2,
        "saved_dump_default": 50,
        "saved_dump_default_source": "user_reported_official_ui",
        "selector_mapping_source": "physically_validated_from_official_ui_order",
        "evidence": "docs/phases/AMP_SUPERO_VOKS_CANDIDATES_PHASE61.md",
        "monitor_integration_physical_validation": "approved",
        "saved_dump_value": 9,
        "physical_validation_without_pcapng": true,
        "range_validated": [
          0,
          100
        ]
      }
    },
    {
      "key": "tone_2",
      "name": "TONE 2",
      "display_order": 4,
      "value_type": "integer",
      "range": {
        "minimum": 0,
        "maximum": 100,
        "step": 1
      },
      "unit": null,
      "protocol": {
        "profile": "effect_parameter_response_1c_v1",
        "value_codec": "upper_float32_nibbles_v1",
        "identification_status": "validated_with_chain_effect_context",
        "message_match": {
          "parameter_selector": 3,
          "parameter_marker": 1,
          "parameter_type": 1
        }
      },
      "validation": {
        "offline": true,
        "physical": true,
        "read_only": true,
        "effect_identity_source": "current_chain",
        "parameter_selector": 3,
        "saved_dump_default": 50,
        "saved_dump_default_source": "user_reported_official_ui",
        "selector_mapping_source": "physically_validated_from_official_ui_order",
        "evidence": "docs/phases/AMP_SUPERO_VOKS_CANDIDATES_PHASE61.md",
        "monitor_integration_physical_validation": "approved",
        "saved_dump_value": 8,
        "physical_validation_without_pcapng": true,
        "range_validated": [
          0,
          100
        ]
      }
    },
    {
      "key": "volume",
      "name": "VOLUME",
      "display_order": 5,
      "value_type": "integer",
      "range": {
        "minimum": 0,
        "maximum": 100,
        "step": 1
      },
      "unit": null,
      "protocol": {
        "profile": "effect_parameter_response_1c_v1",
        "value_codec": "upper_float32_nibbles_v1",
        "identification_status": "validated_with_chain_effect_context",
        "message_match": {
          "parameter_selector": 4,
          "parameter_marker": 1,
          "parameter_type": 1
        }
      },
      "validation": {
        "offline": true,
        "physical": true,
        "read_only": true,
        "effect_identity_source": "current_chain",
        "parameter_selector": 4,
        "saved_dump_default": 50,
        "saved_dump_default_source": "user_reported_official_ui",
        "selector_mapping_source": "physically_validated_from_official_ui_order",
        "evidence": "docs/phases/AMP_SUPERO_VOKS_CANDIDATES_PHASE61.md",
        "monitor_integration_physical_validation": "approved",
        "saved_dump_value": 23,
        "physical_validation_without_pcapng": true,
        "range_validated": [
          0,
          100
        ]
      }
    }
  ]
}
